{"run":56,"commit":"eadad51","metric":61.21,"metrics":{"cli_coverage_pct":0,"tests_passed":1246},"status":"keep","description":"Added 5 CLI messaging.rs mock/SSE tests covering publish, unsubscribe, JSON/text events, and stream_sse frame parsing. Coverage improved from 60.96% to 61.21%; all 1647 tests passed.","timestamp":1780250769984,"segment":0,"confidence":4.5579710144927565,"asi":{"hypothesis":"Messaging CLI command and SSE parsing branches are low-coverage and can be tested with mock axum/SSE servers without real gossip runtime","validation":"cargo fmt --all; cargo test --lib cli::commands::messaging; ./autoresearch.sh all passed","target_files":["src/cli/commands/messaging.rs"],"tests_added":5,"next_action_hint":"Continue CLI mock tests in constitution.rs/daemon.rs/direct/files if still low, or inspect current coverage report for next largest low-coverage non-bin file"}}
{"run":57,"commit":"eadad51","metric":0,"metrics":{"cli_coverage_pct":0,"tests_passed":0},"status":"crash","description":"Aborted identity.rs CLI coverage experiment before autoresearch metrics completed because user changed priority to Phase 3 work.","timestamp":1780251004643,"segment":0,"confidence":4.5579710144927565,"asi":{"hypothesis":"Identity CLI mock tests would improve low identity.rs command coverage","rollback_reason":"Experiment run was aborted by user before metrics were produced; switching priorities to Phase 3 completion","next_action_hint":"If returning to coverage later, re-add identity.rs mock tests and run ./autoresearch.sh to completion","target_files":["src/cli/commands/identity.rs"],"tests_added":6}}
{"run":58,"commit":"6763eb7","metric":61.41,"metrics":{"cli_coverage_pct":0,"tests_passed":1246},"status":"keep","description":"Added 9 identity CLI mock/tempfile tests covering agent/user-id/announce/card/introduction/import/sign and validation branches. Coverage improved from 61.21% to 61.41%; all 1659 tests passed.","timestamp":1780268204748,"segment":0,"confidence":4.468531468531467,"asi":{"hypothesis":"Identity CLI mock tests from the aborted prior experiment would improve low identity command coverage without touching production logic.","result":"Mock DaemonClient tests for identity command HTTP paths and sign input validation increased overall line coverage by 0.20 percentage points.","next_action_hint":"Continue CLI mock coverage in constitution.rs/daemon.rs/files.rs or inspect current llvm-cov report for next largest low-coverage non-bin file; identity.rs easy branches are likely mostly covered now."}}
{"run":59,"commit":"6763eb7","metric":61.41,"metrics":{"cli_coverage_pct":0,"tests_passed":1246},"status":"checks_failed","description":"Tried adding upgrade CLI download_to_file mock tests, but the oversized Content-Length case failed repeatedly and nextest fail-fast prevented full coverage measurement.","timestamp":1780268364165,"segment":0,"confidence":4.14262560777958,"asi":{"hypothesis":"Testing standalone upgrade.rs download_to_file success/error branches with local axum responses would raise coverage in the lowest-covered CLI file.","rollback_reason":"New test download_to_file_rejects_oversized_content_length failed under nextest retries, so the experiment is not valid despite unchanged reported coverage.","next_action_hint":"If retrying upgrade.rs, inspect failure details for content-length behavior or replace oversized Content-Length with HTTP status/success tests only; otherwise target daemon.rs mock paths for safer coverage."}}
{"type":"config","name":"x0x coverage — reviewer+tester coordinated","metricName":"coverage_pct","metricUnit":"%","bestDirection":"higher"}
